"","baseMean","log2FoldChange","lfcSE","stat","pvalue","padj","IDGeneInfo"
"pdam_00012073",539.844017538646,0.979343323600553,0.247037445463474,3.96435172717714,7.35956734984249e-05,0.000939048620867881,"pdam_00012073 SLC7A2: Cationic amino acid transporter 2 (Homo sapiens)"
"pdam_00016705",2686.40488229021,1.91550820350685,0.483178337769448,3.96439172407776,7.3583335987325e-05,0.000939048620867881,"pdam_00016705 PCK1: Phosphoenolpyruvate carboxykinase%2C cytosolic [GTP] (Homo sapiens)"
"pdam_00019589",10.6826992186944,2.2474251554547,0.567006275761538,3.96366892489191,7.38065938575801e-05,0.000941168428347722,"pdam_00019589 Pxdn: Peroxidasin homolog (Mus musculus)"
"pdam_00008977",147.87357043235,-0.936227124290528,0.236290915056889,-3.96217994274187,7.42685307546812e-05,0.000946484641485522,"pdam_00008977 RHO1: GTP-binding protein RHO1 (Ashbya gossypii (strain ATCC 10895 / CBS 109.51 / FGSC 9923 / NRRL Y-1056))"
"pdam_00022431",340.47268499336,1.58803891692991,0.400991132572555,3.96028437522261,7.48605620944737e-05,0.000953451340857797,"pdam_00022431 Ankk1: Ankyrin repeat and protein kinase domain-containing protein 1 (Mus musculus)"
"pdam_00016432",97.3961980317861,-1.08421066769734,0.273866187078598,-3.95890664438315,7.52936583022417e-05,0.000958386571303215,"pdam_00016432 FAP: Prolyl endopeptidase FAP (Homo sapiens)"
"pdam_00006239",108.797783549768,-1.59057054989082,0.401818711990863,-3.95842827231745,7.5444590219061e-05,0.000959726430661966,"pdam_00006239 unknown function"
"pdam_00005298",64.2834858469544,-0.941008119985938,0.237748557621221,-3.95799717735888,7.55808507115593e-05,0.000960297205382962,"pdam_00005298 notum2: Palmitoleoyl-protein carboxylesterase notum2 (Xenopus laevis)"
"pdam_00003000",56.3075635697818,1.73143733558354,0.437442870773743,3.95808790418963,7.55521544548465e-05,0.000960297205382962,"pdam_00003000 K02A11.3: Poly(U)-specific endoribonuclease homolog (Caenorhabditis elegans)"
"pdam_00005231",473.002889575015,1.19185324898797,0.301185636170833,3.95720481275525,7.58319084975901e-05,0.000962904868324384,"pdam_00005231 CAM: Calmodulin (Paramecium tetraurelia)"
"pdam_00017887",25.4113058798311,-1.34908568190435,0.340949441801702,-3.95684965716703,7.59446939885355e-05,0.0009637546764306,"pdam_00017887 Cubn: Cubilin (Rattus norvegicus)"
"pdam_00016506",25.9184859858351,-1.46535703607302,0.370350486934203,-3.95667641266895,7.59997681665549e-05,0.000963871531695927,"pdam_00016506 unknown function"
"pdam_00015649",20.5359260194163,-3.0663139904596,0.775007899689011,-3.95649385211432,7.60578447716125e-05,0.000964026301493026,"pdam_00015649 unknown function"
"pdam_00017085",94.3082439691369,0.894668079662707,0.226194749425087,3.95529994368419,7.64386896931973e-05,0.00096826947794005,"pdam_00017085 unknown function"
"pdam_00019335",226.018884560952,0.708452652814205,0.179123223219205,3.95511335761989,7.64983714699229e-05,0.000968441732795439,"pdam_00019335 EFL1: Elongation factor-like GTPase 1 (Homo sapiens)"
"pdam_00014206",6.40016487632686,3.11096312604219,0.786653798651103,3.95467883251394,7.66375303363502e-05,0.000969619325718483,"pdam_00014206 unknown function"
"pdam_00013387",13.1179110500718,1.47813490783145,0.374046185196867,3.95174437363525,7.75835908474449e-05,0.000980998292213631,"pdam_00013387 G-protein coupled receptor GRL101 (Lymnaea stagnalis)"
"pdam_00012013",78.4583560116634,1.03355547384231,0.261655642742058,3.95005994524335,7.81316226223697e-05,0.000987333763926097,"pdam_00012013 unknown function"
"pdam_00007638",7.20135890873211,2.08722496007509,0.528504686917486,3.94930264904342,7.83792010865875e-05,0.000989867133915046,"pdam_00007638 hisat: Histidine N-acetyltransferase (Scomber australasicus)"
"pdam_00003787",15.974988718527,-2.83826802215852,0.718709283865204,-3.9491183512955,7.84395645978753e-05,0.000990034504519129,"pdam_00003787 MMP9: Matrix metalloproteinase-9 (Canis lupus familiaris)"
"pdam_00023247",3.26020705671385,3.39180811664406,0.859154065266635,3.94784620566443,7.8857434015477e-05,0.000991141731958881,"pdam_00023247 unknown function"
"pdam_00010975",98.9213339253952,-0.857279252121874,0.217125417859126,-3.94831365472875,7.87036441930221e-05,0.000991141731958881,"pdam_00010975 unknown function"
"pdam_00005473",538.154271845737,0.513574877508963,0.130089513628321,3.94785761884158,7.88536757214298e-05,0.000991141731958881,"pdam_00005473 ARFIP2: Arfaptin-2 (Bos taurus)"
"pdam_00021202",28.30973275016,-1.33540704569023,0.338199697406685,-3.94857551893195,7.86176153433415e-05,0.000991141731958881,"pdam_00021202 unknown function"
"pdam_00019468",15.7784935934968,-1.39039656193326,0.352161077086079,-3.94818352282983,7.87464288270608e-05,0.000991141731958881,"pdam_00019468 unknown function"
"pdam_00006254",12.222236185536,-2.3908221690056,0.605585898913123,-3.94794887611574,7.88236313116892e-05,0.000991141731958881,"pdam_00006254 Techylectin-5A (Tachypleus tridentatus)"
"pdam_00002483",665.073184324669,0.617427847985885,0.156381112821821,3.94822518426106,7.8732729031519e-05,0.000991141731958881,"pdam_00002483 TOP1: DNA topoisomerase 1 (Homo sapiens)"
"pdam_00020210",13.6963798892217,-2.11726986160689,0.536361357596926,-3.94746905536399,7.89817227560603e-05,0.000991908867490393,"pdam_00020210 unknown function"
"pdam_00020252",317.465557150587,-0.797756609564176,0.2021053461303,-3.94723160390746,7.90600691432981e-05,0.000991908867490393,"pdam_00020252 Loxhd1: Lipoxygenase homology domain-containing protein 1 (Mus musculus)"
"pdam_00019304",18.0328530222325,1.47699906700654,0.374185846612375,3.94723392233642,7.90593038296488e-05,0.000991908867490393,"pdam_00019304 Mfge8: Lactadherin (Mus musculus)"
"pdam_00017607",266.156359414577,0.704046525903965,0.178419691982114,3.9460135710499,7.9463111769243e-05,0.000996370700376278,"pdam_00017607 unknown function"
"pdam_00008295",153.964736425156,-0.880702460737926,0.223244405973225,-3.94501468871544,7.9795087094876e-05,0.000999936645974251,"pdam_00008295 unknown function"
"pdam_00004125",22.5410228424961,3.04182486660172,0.771170155921594,3.94442762501171,7.99908070761847e-05,0.00100179190149346,"pdam_00004125 unknown function"
"pdam_00006432",353.34327186311,0.651806803595347,0.165324905708602,3.94258082774416,8.06094705189158e-05,0.00100893866763253,"pdam_00006432 STRAP: Serine-threonine kinase receptor-associated protein (Gallus gallus)"
"pdam_00025526",1082.55972440771,0.516093829098821,0.130920279412375,3.94204649894779,8.07893086118208e-05,0.00101058769076037,"pdam_00025526 Metap2: Methionine aminopeptidase 2 (Mus musculus)"
"pdam_00018383",13.6843311692489,2.24364758382312,0.569211111340865,3.94167917512688,8.09131580351707e-05,0.00101153481029691,"pdam_00018383 unknown function"
"pdam_00024726",29.4084825257184,-2.05412314413049,0.521167295836247,-3.94138918643104,8.10110593588816e-05,0.00101215660667473,"pdam_00024726 ZMYM1: Zinc finger MYM-type protein 1 (Homo sapiens)"
"pdam_00003931",227.618767933745,2.90937787187973,0.738513904539102,3.93950317522517,8.16505215087407e-05,0.00101953993434711,"pdam_00003931 unknown function"
"pdam_00003438",181.877868106786,-1.39380819345264,0.353883972086134,-3.93860220692164,8.19576807897104e-05,0.00102276761389297,"pdam_00003438 unknown function"
"pdam_00005573",4.19252043689181,-3.98994136734443,1.01324575717534,-3.93778245710827,8.22380995613027e-05,0.00102565795981055,"pdam_00005573 fimA: Fimbrin (Dictyostelium discoideum)"
"pdam_00018340",29.1590036285114,-1.38357562411695,0.351477758095115,-3.93645285441513,8.26948571119843e-05,0.00103074283642251,"pdam_00018340 unknown function"
"pdam_00014461",60.7027819112241,-1.03562588607376,0.263098621723909,-3.93626496135937,8.275959691271e-05,0.00103093831008927,"pdam_00014461 unknown function"
"pdam_00021763",43.5558052802683,0.9453169744531,0.24023513981353,3.93496544754799,8.32086660737318e-05,0.00103591831607789,"pdam_00021763 unknown function"
"pdam_00011956",433.304861703874,1.08068092916999,0.274736782046341,3.93351382046729,8.37130232900547e-05,0.00104158033418621,"pdam_00011956 POMP: Proteasome maturation protein (Bos taurus)"
"pdam_00025809",75.9527434962635,-3.75125684260346,0.954162099653648,-3.93146703685373,8.4429073891194e-05,0.00104986804013221,"pdam_00025809 unknown function"
"pdam_00015011",264.64864838546,0.616522017719026,0.156844781530357,3.9307780067882,8.4671424864408e-05,0.00105163711201273,"pdam_00015011 Timm44: Mitochondrial import inner membrane translocase subunit TIM44 (Mus musculus)"
"pdam_00018453",2028.21140286427,0.831190471963622,0.21145034166624,3.93090153183862,8.46279293740649e-05,0.00105163711201273,"pdam_00018453 unknown function"
"pdam_00018830",49.0858405329791,-1.64564125015923,0.418698756675137,-3.9303705203884,8.48150583136479e-05,0.00105232248918876,"pdam_00018830 Loxhd1: Lipoxygenase homology domain-containing protein 1 (Mus musculus)"
"pdam_00003122",151.787902613762,-0.795381514716368,0.20236978198099,-3.93033736030354,8.4826756920569e-05,0.00105232248918876,"pdam_00003122 GOLIM4: Golgi integral membrane protein 4 (Homo sapiens)"
"pdam_00017739",1895.05932602509,0.514948603706635,0.131028754746364,3.93004272003831,8.49307705845514e-05,0.0010529912353005,"pdam_00017739 Ppp2r2a: Serine/threonine-protein phosphatase 2A 55 kDa regulatory subunit B alpha isoform (Rattus norvegicus)"
"pdam_00014216",121.835341541836,-1.08486339915279,0.276064266041682,-3.92974945547277,8.50344182695141e-05,0.00105365465797986,"pdam_00014216 CHRNA7: Neuronal acetylcholine receptor subunit alpha-7 (Gallus gallus)"
"pdam_00018306",373.112367228246,-2.12679262772205,0.541323252596262,-3.92887727900409,8.53433759746044e-05,0.00105679614585498,"pdam_00018306 unknown function"
"pdam_00023378",208.428206451063,1.25027509653416,0.318237371385059,3.92875007448877,8.53885251326082e-05,0.00105679614585498,"pdam_00023378 unknown function"
"pdam_00003461",83.514460642491,-1.10831023984304,0.282137221512474,-3.92826665656391,8.55603123540361e-05,0.00105829897829315,"pdam_00003461 HSPA12A: Heat shock 70 kDa protein 12A (Homo sapiens)"
"pdam_00000361",1007.84639934842,1.03272621509578,0.26296154758093,3.92728984369071,8.590842934719e-05,0.00106197978984188,"pdam_00000361 CD53: Leukocyte surface antigen CD53 (Homo sapiens)"
"pdam_00022788",632.754640503827,0.489411797009643,0.1246299436506,3.92691982900761,8.60406444945081e-05,0.00106233887587526,"pdam_00022788 PIEZO2: Piezo-type mechanosensitive ion channel component 2 (Homo sapiens)"
"pdam_00013551",39.790783594071,-1.10250106278011,0.280764357693046,-3.92678426791427,8.60891318399032e-05,0.00106233887587526,"pdam_00013551 WBSCR27: Williams-Beuren syndrome chromosomal region 27 protein (Homo sapiens)"
"pdam_00025794",47.7640772682754,-1.80104008090638,0.458638403199861,-3.92692820387642,8.60376498269604e-05,0.00106233887587526,"pdam_00025794 unknown function"
"pdam_00019194",100.459455357195,0.734493150143825,0.187071494067568,3.92626976015134,8.62733954752368e-05,0.00106398791426767,"pdam_00019194 hmces: Embryonic stem cell-specific 5-hydroxymethylcytosine-binding protein (Xenopus tropicalis)"
"pdam_00002380",244.712536837786,-0.896018389642425,0.228219483924002,-3.92612573754134,8.63250418424515e-05,0.0010640004424159,"pdam_00002380 unknown function"
"pdam_00014775",905.266531806298,0.559244116493958,0.14251404053727,3.92413347053833,8.70424705436005e-05,0.00107221425467395,"pdam_00014775 rbmx: RNA-binding motif protein%2C X chromosome (Danio rerio)"
"pdam_00021200",252.026298956356,1.33504737787609,0.340320885393751,3.92290757098684,8.74867209449552e-05,0.00107705532551742,"pdam_00021200 ZP domain-containing protein (Acropora millepora)"
"pdam_00024288",120.657179733755,0.898448367553397,0.22904255229031,3.92262642277326,8.75889070283854e-05,0.00107768201475499,"pdam_00024288 Man1b1: Endoplasmic reticulum mannosyl-oligosaccharide 1%2C2-alpha-mannosidase (Mus musculus)"
"pdam_00017684",1037.84059919895,0.581992941715946,0.148391986343129,3.92199711088304,8.78180454656231e-05,0.0010798690611235,"pdam_00017684 GANAB: Neutral alpha-glucosidase AB (Sus scrofa)"
"pdam_00011389",129.330674451534,-1.32302786583376,0.337450309310045,-3.92065981074026,8.83068509317246e-05,0.00108524472066093,"pdam_00011389 SLC15A2: Solute carrier family 15 member 2 (Homo sapiens)"
"pdam_00001679",549.802903145078,0.576125507563459,0.146954385733656,3.92043765612852,8.83883006893288e-05,0.00108561083517606,"pdam_00001679 ttc29: Tetratricopeptide repeat protein 29 (Xenopus laevis)"
"pdam_00007805",141.128495094774,0.795316851545648,0.202877728908994,3.92017820695542,8.84835137996977e-05,0.00108614546875038,"pdam_00007805 Exosc5: Exosome complex component RRP46 (Mus musculus)"
"pdam_00011182",295.530099721414,0.40947725749731,0.104469657730747,3.91958073178214,8.87031449049729e-05,0.00108820583197782,"pdam_00011182 B4galt7: Beta-1%2C4-galactosyltransferase 7 (Mus musculus)"
"pdam_00001408",1532.70310736623,0.43591025183691,0.111227286650039,3.91909454024929,8.88822482457484e-05,0.00108976688849732,"pdam_00001408 SETD5: SET domain-containing protein 5 (Homo sapiens)"
"pdam_00017341",1800.60605958699,1.28697561718467,0.328448416509455,3.91834928255048,8.91574497610257e-05,0.00109186702023774,"pdam_00017341 Ectin (Fragment) (Acropora millepora)"
"pdam_00001507",206.737064089773,-0.650222923606593,0.1659406042573,-3.91840759238399,8.9135888679924e-05,0.00109186702023774,"pdam_00001507 GALNT1: Polypeptide N-acetylgalactosaminyltransferase 1 (Sus scrofa)"
"pdam_00012961",236.80805540017,-1.25962282119095,0.321486901480728,-3.91811552940194,8.9243933551513e-05,0.00109228961187248,"pdam_00012961 Npc1l1: Niemann-Pick C1-like protein 1 (Rattus norvegicus)"
"pdam_00024962",62.0225532787741,0.824134581684052,0.21036925554911,3.9175619057684,8.9449078971844e-05,0.00109416320989133,"pdam_00024962 unknown function"
"pdam_00013652",12.0346888808486,1.41206161317903,0.360478146136101,3.91719062116431,8.95869080715004e-05,0.00109454650559484,"pdam_00013652 eys: Protein eyes shut (Drosophila melanogaster)"
"pdam_00004881",62.2948149804993,-0.916510498018366,0.233966017116436,-3.91728042095212,8.95535540123059e-05,0.00109454650559484,"pdam_00004881 smug1: Single-strand selective monofunctional uracil DNA glycosylase (Xenopus laevis)"
"pdam_00018866",98.8072363235371,-0.971844607990849,0.248105830105668,-3.9170567155836,8.96366660066009e-05,0.00109454650559484,"pdam_00018866 unknown function"
"pdam_00008202",116.08654392442,-0.902171864788035,0.230389251143756,-3.91585918314004,9.00828189297293e-05,0.00109935565610236,"pdam_00008202 unknown function"
"pdam_00005412",4.92038205396614,3.12332884031365,0.797992527557845,3.91398256556637,9.07861935056295e-05,0.00110729649246709,"pdam_00005412 ADORA2B: Adenosine receptor A2b (Gallus gallus)"
"pdam_00026036",31.429589991791,1.78701924271836,0.456599042971264,3.91376037735328,9.08698144347964e-05,0.00110767352108309,"pdam_00026036 UMOD: Uromodulin (Homo sapiens)"
"pdam_00019655",1026.92859363838,-0.515344845647094,0.131708042514016,-3.91278190617897,9.12389301957583e-05,0.00111141082260127,"pdam_00019655 Lrig3: Leucine-rich repeats and immunoglobulin-like domains protein 3 (Mus musculus)"
"pdam_00008853",481.825594919116,0.771583488105083,0.197201395043562,3.91266749372965,9.12821831934233e-05,0.00111141082260127,"pdam_00008853 CTSC: Dipeptidyl peptidase 1 (Homo sapiens)"
"pdam_00023982",22.6437207985347,-1.32093937281236,0.33763337058217,-3.91234838705283,9.14029220800642e-05,0.00111159282842161,"pdam_00023982 MATN2: Matrilin-2 (Homo sapiens)"
"pdam_00001041",98.4335564173334,-1.10460418477896,0.282335190629706,-3.91238577917016,9.13887664030476e-05,0.00111159282842161,"pdam_00001041 Tmprss9: Transmembrane protease serine 9 (Mus musculus)"
"pdam_00017173",136.423392746619,1.64007378608759,0.419254147337934,3.91188446554741,9.15787229540478e-05,0.00111308667604356,"pdam_00017173 unknown function"
"pdam_00016943",120.94988424698,-1.21716645046934,0.311212213845773,-3.9110497477857,9.18958398731953e-05,0.00111629541903769,"pdam_00016943 Tmprss9: Transmembrane protease serine 9 (Rattus norvegicus)"
"pdam_00015425",287.524431430636,0.382480192717616,0.0977984469663344,3.91090252025453,9.19518804492083e-05,0.00111633088829585,"pdam_00015425 Vps54: Vacuolar protein sorting-associated protein 54 (Mus musculus)"
"pdam_00010011",15.2483660064287,1.60098993153518,0.409522818507461,3.90940347932288,9.25243146679537e-05,0.0011226319126715,"pdam_00010011 unknown function"
"pdam_00021488",297.993585277136,-1.34979801526609,0.345302016201142,-3.90903600887121,9.26651522624792e-05,0.0011230439301015,"pdam_00021488 unknown function"
"pdam_00024565",53.2186114674548,-1.19939366301254,0.306820392008378,-3.90910674209617,9.26380271536141e-05,0.0011230439301015,"pdam_00024565 unknown function"
"pdam_00000613",570.180170789804,-0.750502092919267,0.192014108173359,-3.9085778647144,9.2841025255524e-05,0.00112449995788065,"pdam_00000613 CFAP65: Cilia- and flagella-associated protein 65 (Gallus gallus)"
"pdam_00020766",199.442970406836,-0.941339511852962,0.240847613718335,-3.90844441977255,9.2892311533705e-05,0.00112449995788065,"pdam_00020766 Brf1: Transcription factor IIIB 90 kDa subunit (Mus musculus)"
"pdam_00001051",5.6354090983205,-2.80785175184034,0.718894769203388,-3.9057896539597,9.3918183336461e-05,0.0011362640315577,"pdam_00001051 G-protein coupled receptor GRL101 (Lymnaea stagnalis)"
"pdam_00007300",2785.93552488812,0.367754607064238,0.0941605708368838,3.90561148680064,9.39874135706836e-05,0.00113644735108626,"pdam_00007300 B52: Serine-arginine protein 55 (Drosophila melanogaster)"
"pdam_00008206",44.3679771476115,1.92936141342456,0.494037847163251,3.90529070698305,9.41121801733871e-05,0.00113730159076695,"pdam_00008206 ANGPTL7: Angiopoietin-related protein 7 (Homo sapiens)"
"pdam_00008309",155.7432183968,-0.869182439707242,0.222583992205313,-3.90496383453084,9.42394773759015e-05,0.00113818541210033,"pdam_00008309 unknown function"
"pdam_00017035",52.1832045299277,-0.910782956554778,0.233245964344908,-3.90481764223784,9.42964631084364e-05,0.00113821951305215,"pdam_00017035 Map2: Microtubule-associated protein 2 (Rattus norvegicus)"
"pdam_00002484",118.846419085455,0.841886511561844,0.215615941387852,3.90456524755491,9.43949231098461e-05,0.00113875390881367,"pdam_00002484 Nlrp12: NACHT%2C LRR and PYD domains-containing protein 12 (Mus musculus)"
"pdam_00000767",603.331775527617,0.793958266238001,0.203358209393616,3.90423513565284,9.4523847390078e-05,0.00113965499305937,"pdam_00000767 SLC24A2: Sodium/potassium/calcium exchanger 2 (Gallus gallus)"
"pdam_00021161",226.129599714062,0.522056990616435,0.13375595692569,3.90305600300456,9.49857133823891e-05,0.00114456695340075,"pdam_00021161 COG7: Conserved oligomeric Golgi complex subunit 7 (Homo sapiens)"
"pdam_00000003",54.9110376447911,-1.99455723118711,0.51112964517273,-3.90225307810716,9.53014376491671e-05,0.00114771330211877,"pdam_00000003 unknown function"
"pdam_00024929",449.966676609942,1.80043257230479,0.461606820840988,3.90035955063365,9.60499347481559e-05,0.00115606493627291,"pdam_00024929 ABL: Tyrosine-protein kinase transforming protein Abl (Abelson murine leukemia virus)"
"pdam_00005983",4.63299004086336,-3.50449023168127,0.898844409461176,-3.89888416147805,9.6636988844599e-05,0.00116199355637972,"pdam_00005983 LINE-1 reverse transcriptase homolog (Nycticebus coucang)"
"pdam_00001759",524.205501441829,0.672657985629248,0.172527553944753,3.89884380928885,9.66530923888532e-05,0.00116199355637972,"pdam_00001759 TPP2: Tripeptidyl-peptidase 2 (Bos taurus)"
"pdam_00000304",2030.61269362238,0.916343190822203,0.235038106047259,3.89870053938383,9.67102882766245e-05,0.00116201641402702,"pdam_00000304 bicdl1: BICD family-like cargo adapter 1 (Xenopus tropicalis)"
"pdam_00025326",29.4362558241223,2.56608344788905,0.658280996291074,3.89815817613912,9.69270989157446e-05,0.00116395599069393,"pdam_00025326 Maob: Amine oxidase [flavin-containing] B (Rattus norvegicus)"
"pdam_00020226",63.6278419586279,-0.991030020292329,0.254377999184701,-3.89589517752576,9.78366985373717e-05,0.0011742080067178,"pdam_00020226 RNF14: E3 ubiquitin-protein ligase RNF14 (Homo sapiens)"
"pdam_00001273",323.548970439486,-0.782352990471066,0.200874239747441,-3.89474026861144,9.83040078555632e-05,0.00117914310792503,"pdam_00001273 Uncharacterized protein C17orf105 homolog (Mus musculus)"
"pdam_00021203",452.562033355877,1.23702366831514,0.31770485163706,3.89362536310366,9.87571290795097e-05,0.00118390249150365,"pdam_00021203 unknown function"
"pdam_00014967",741.964952669734,0.417096115817604,0.107133032899013,3.89325406488561,9.89084697159109e-05,0.00118504075888248,"pdam_00014967 OSBPL8: Oxysterol-binding protein-related protein 8 (Homo sapiens)"
"pdam_00004419",35.0503524133021,1.29501734174013,0.332668435906272,3.89281699723685,9.90868984373338e-05,0.00118650209154448,"pdam_00004419 TRAF3: TNF receptor-associated factor 3 (Homo sapiens)"
"pdam_00019143",151.48102904007,-1.50508765188548,0.386682288089813,-3.89231081496006,9.9293922292945e-05,0.00118806296085444,"pdam_00019143 unknown function"
"pdam_00006267",185.498989525135,-0.907368452596752,0.233123513739169,-3.89222193009653,9.93303174980374e-05,0.00118806296085444,"pdam_00006267 rasl11b: Ras-like protein family member 11B (Danio rerio)"
"pdam_00023851",2.78415042397376,4.47069225077446,1.14876741559589,3.89172968355427,9.95321031331982e-05,0.00118979928745402,"pdam_00023851 unknown function"
"pdam_00020234",49.746015611981,-1.70069560948245,0.437120114367691,-3.890682568892,9.9962632584749e-05,0.0011942664717274,"pdam_00020234 unknown function"
"pdam_00014958",12.4735001644803,-2.83825224098106,0.729565026788826,-3.89033483892944,0.000100105992910121,0.00119529968238989,"pdam_00014958 amt-1: Putative ammonium transporter 1 (Caenorhabditis elegans)"
"pdam_00025771",110.880797363762,2.46987396805205,0.635319742169056,3.88760777308701,0.000101237042047,0.00120811836378064,"pdam_00025771 Traf5: TNF receptor-associated factor 5 (Mus musculus)"
"pdam_00010993",527.793998117622,-0.623509193189675,0.160432583869011,-3.88642492786101,0.000101731367799581,0.00121236733701742,"pdam_00010993 ECE1: Endothelin-converting enzyme 1 (Cavia porcellus)"
"pdam_00002152",20.7952566309925,-1.98049693703475,0.509604405820508,-3.88634186520812,0.000101766166190755,0.00121236733701742,"pdam_00002152 unknown function"
"pdam_00007827",216.811593319962,3.49262387971985,0.898646330875764,3.88653885262755,0.000101683658254695,0.00121236733701742,"pdam_00007827 Perlucin-like protein (Mytilus galloprovincialis)"
"pdam_00007828",87.8761189637921,-4.62947374394609,1.1913753092475,-3.88582313903262,0.000101983736404782,0.00121427094648527,"pdam_00007828 Perlucin-like protein (Mytilus galloprovincialis)"
"pdam_00017983",51.5340349591031,0.799548919091917,0.205777542674722,3.88550134625616,0.00010211892708693,0.00121519210233965,"pdam_00017983 unknown function"
"pdam_00001883",940.393443494557,0.61053978679689,0.15716201661432,3.88477954119902,0.000102422785302676,0.0012174292042623,"pdam_00001883 CYP3A24: Cytochrome P450 3A24 (Ovis aries)"
"pdam_00003876",268.269503366331,0.602734377765456,0.155152216875502,3.88479384892777,0.000102416753897849,0.0012174292042623,"pdam_00003876 Acp6: Lysophosphatidic acid phosphatase type 6 (Mus musculus)"
"pdam_00008768",3.46088467609961,-4.11261919327072,1.0587061600945,-3.88457094922694,0.00010251075506351,0.00121778604729206,"pdam_00008768 Octopamine receptor 1 (Lymnaea stagnalis)"
"pdam_00022118",330.3110197551,1.29100377876975,0.332429662464102,3.88353966129349,0.000102946730308556,0.00122227431493463,"pdam_00022118 HEPACAM2: HEPACAM family member 2 (Bos taurus)"
"pdam_00012252",2.62336367513002,4.23225660818003,1.09041726629948,3.88131840808329,0.000103891712459605,0.00123071270424949,"pdam_00012252 nit2: Omega-amidase NIT2 (Danio rerio)"
"pdam_00010068",153.656501065621,0.700841476745281,0.180556619829147,3.88156068389217,0.000103788245299417,0.00123071270424949,"pdam_00010068 SPHK1: Sphingosine kinase 1 (Homo sapiens)"
"pdam_00019551",65.8903129392807,-1.46753429606778,0.378096890282769,-3.88137097602216,0.000103869254344455,0.00123071270424949,"pdam_00019551 TACR2: Substance-K receptor (Canis lupus familiaris)"
"pdam_00023272",47.1796523383837,-2.44411211174249,0.629671244768658,-3.88156856780153,0.000103784880003677,0.00123071270424949,"pdam_00023272 unknown function"
"pdam_00007769",50.3316494875471,1.08526826289144,0.279698168300795,3.88014075846327,0.000104396031746488,0.00123599020121265,"pdam_00007769 Pkd1l2: Polycystic kidney disease protein 1-like 2 (Mus musculus)"
"pdam_00022938",10.5217410153489,3.59833064405334,0.927485696638016,3.87966160243408,0.000104601887100991,0.00123773009990278,"pdam_00022938 unknown function"
"pdam_00006942",25.7463816041632,-1.29822195643235,0.334728562476152,-3.87843196537744,0.000105131918985592,0.00124330178811605,"pdam_00006942 unknown function"
"pdam_00017391",448.004299713925,-1.04948438585069,0.270638837687849,-3.8778040683915,0.000105403548918304,0.00124581303741179,"pdam_00017391 OPLAH: 5-oxoprolinase (Homo sapiens)"
"pdam_00014878",17.7550123114168,1.57634393821709,0.406570929557549,3.87716834534271,0.000105679239052017,0.00124836942590115,"pdam_00014878 unknown function"
"pdam_00004809",419.080908340967,-0.7193419138869,0.185553306079049,-3.87673994652754,0.000105865403773589,0.00124986598893369,"pdam_00004809 WDR89: WD repeat-containing protein 89 (Pongo abelii)"
"pdam_00020895",1191.00586876815,0.770651731674237,0.198867013336248,3.87521147296161,0.000106532141188217,0.0012570314132905,"pdam_00020895 Mpc1: Mitochondrial pyruvate carrier 1 (Rattus norvegicus)"
"pdam_00014471",51.2017788424013,-1.08050253571984,0.278856263279094,-3.87476516759611,0.000106727570784892,0.00125792478970528,"pdam_00014471 Gas6: Growth arrest-specific protein 6 (Mus musculus)"
"pdam_00011698",63.7696771767718,-0.81683909422179,0.210807417290026,-3.87481192418383,0.000106707081010543,0.00125792478970528,"pdam_00011698 FGF18: Fibroblast growth factor 18 (Homo sapiens)"
