"","baseMean","log2FoldChange","lfcSE","stat","pvalue","padj","IDGeneInfo"
"pdam_00002342",346.450278323314,1.61409991335591,0.459669953563599,3.51143228057994,0.000445699001119533,0.00379512338270948,"pdam_00002342 Col6a5: Collagen alpha-5(VI) chain (Mus musculus)"
"pdam_00011312",287.493793924187,-0.611647349483376,0.17418715533042,-3.51143773100335,0.000445689861951823,0.00379512338270948,"pdam_00011312 MAP3K12: Mitogen-activated protein kinase kinase kinase 12 (Homo sapiens)"
"pdam_00012676",155.15777306201,-1.6782529664273,0.478022810845329,-3.51082192805716,0.000446723536014181,0.00379926122646561,"pdam_00012676 Inhbb: Inhibin beta B chain (Rattus norvegicus)"
"pdam_00000765",2282.30645761484,0.615649881156518,0.175352162757907,3.5109340624814,0.000446535143024537,0.00379926122646561,"pdam_00000765 Arnt: Aryl hydrocarbon receptor nuclear translocator (Mus musculus)"
"pdam_00010810",59.4676585505912,1.68072710950755,0.478727836409099,3.51081968016431,0.000446727313375995,0.00379926122646561,"pdam_00010810 H4DEKL: Histone H4 (Dendronephthya klunzingeri)"
"pdam_00011678",225.023051452246,-0.879490503345402,0.250627523940516,-3.50915370154692,0.000449535038691917,0.00382004805422994,"pdam_00011678 CDH23: Cadherin-23 (Homo sapiens)"
"pdam_00014406",51.7805512754592,2.18782774381851,0.623444575693655,3.50925780593134,0.000449359107051556,0.00382004805422994,"pdam_00014406 unknown function"
"pdam_00005613",4.26274721234447,-3.59170759447615,1.02356389091486,-3.50902139705796,0.000449758719980748,0.00382040400177664,"pdam_00005613 unknown function"
"pdam_00017978",1081.46260395741,1.00018499163792,0.285050763089134,3.508796050215,0.000450139942968803,0.0038220973339351,"pdam_00017978 Acaa2: 3-ketoacyl-CoA thiolase%2C mitochondrial (Mus musculus)"
"pdam_00000664",1128.91998037566,0.978986526991334,0.279185948508828,3.50657521347417,0.0004539131338783,0.00385257855753331,"pdam_00000664 psmb3: Proteasome subunit beta type-3 (Oncorhynchus mykiss)"
"pdam_00007237",69.3434232549222,-0.601691210365095,0.171594968776769,-3.50646184240894,0.000454106540349195,0.00385266408778294,"pdam_00007237 poc1a: POC1 centriolar protein homolog A (Xenopus tropicalis)"
"pdam_00017301",25.2301652025386,-2.1343181336626,0.609000291392324,-3.50462580039662,0.000457249481219653,0.00387776345755892,"pdam_00017301 unknown function"
"pdam_00022606",209.777189948476,-1.02422134336326,0.292267169606965,-3.50440093815742,0.000457635793058837,0.00387947405854436,"pdam_00022606 DZIP3: E3 ubiquitin-protein ligase DZIP3 (Homo sapiens)"
"pdam_00022239",1068.24777176837,0.805573314738511,0.229889221526377,3.50418044565034,0.000458014893442782,0.00387955783381704,"pdam_00022239 VAMP1: Vesicle-associated membrane protein 1 (Bos taurus)"
"pdam_00022215",5.19916010243422,2.59336282990772,0.74006522271103,3.50423550563236,0.000457920199471906,0.00387955783381704,"pdam_00022215 unknown function"
"pdam_00008256",70.826380492353,2.30853395500315,0.658844636264713,3.50391249762807,0.000458475980162426,0.00388189876031965,"pdam_00008256 unknown function"
"pdam_00010673",941.700321292595,0.961810517518628,0.274653046954078,3.5019109679837,0.000461933951899791,0.00390960209390822,"pdam_00010673 Cytochrome c (Pectinaria gouldii)"
"pdam_00012255",84.807430482127,0.753117047628448,0.215130030115077,3.50075276438901,0.000463946038547071,0.00392189300083133,"pdam_00012255 Oma1: Metalloendopeptidase OMA1%2C mitochondrial (Rattus norvegicus)"
"pdam_00006408",141.980851894931,-0.650433780965324,0.185794493241025,-3.50082378448935,0.000463822424078511,0.00392189300083133,"pdam_00006408 unknown function"
"pdam_00010881",81.0806135101075,-3.91210265997701,1.11745324405044,-3.50090948395905,0.000463673300257813,0.00392189300083133,"pdam_00010881 unknown function"
"pdam_00019947",1.52496268285814,4.51325070090215,1.28941176340292,3.50024005441918,0.000464839351363442,0.00392786448287203,"pdam_00019947 unknown function"
"pdam_00001465",916.472748273843,1.42786300052853,0.407951357070955,3.50008150672774,0.000465115919338989,0.0039286218026161,"pdam_00001465 Moxd1: DBH-like monooxygenase protein 1 (Mus musculus)"
"pdam_00014877",93.1784420205266,-0.603203817180431,0.172374411632299,-3.49938144222447,0.000466338936830389,0.00393736952892351,"pdam_00014877 CCDC158: Coiled-coil domain-containing protein 158 (Homo sapiens)"
"pdam_00019785",451.151073742261,-0.574595759927627,0.164208454919773,-3.49918498537945,0.000466682687029501,0.00393868942486947,"pdam_00019785 UTP4: U3 small nucleolar RNA-associated protein 4 homolog (Homo sapiens)"
"pdam_00021064",505.676197789621,0.747857508256805,0.213732660573779,3.49903241857905,0.000466949803723391,0.00393936175240749,"pdam_00021064 Nek4: Serine/threonine-protein kinase Nek4 (Mus musculus)"
"pdam_00000427",25.4826273527645,-2.08233031561689,0.595217810775792,-3.49843414951382,0.000467998640914172,0.00394504269507073,"pdam_00000427 unknown function"
"pdam_00002561",508.739690129461,0.994357976518513,0.284227573817972,3.49845711013011,0.000467958347685693,0.00394504269507073,"pdam_00002561 Pepd: Xaa-Pro dipeptidase (Rattus norvegicus)"
"pdam_00008985",273.470141219729,-0.671538081058256,0.191967383237349,-3.4981884408351,0.000468430033952726,0.00394709589555595,"pdam_00008985 unknown function"
"pdam_00007904",35.0954831864916,1.30464107293632,0.372990826942444,3.49778326622934,0.000469142213168282,0.00395151246883024,"pdam_00007904 SACS: Sacsin (Homo sapiens)"
"pdam_00005285",469.104512229978,0.708382090291688,0.202571907518153,3.49694140204613,0.000470625196805521,0.00396241526877725,"pdam_00005285 Ngly1: Peptide-N(4)-(N-acetyl-beta-glucosaminyl)asparagine amidase (Mus musculus)"
"pdam_00018954",27.535028017133,0.970153425316174,0.277526741167962,3.49571151678327,0.000472799560703708,0.00397912806094851,"pdam_00018954 MC1R: Melanocyte-stimulating hormone receptor (Chaetodipus baileyi)"
"pdam_00004385",110.765911371237,-0.853771580720235,0.244299286629459,-3.49477721568296,0.000474457609072006,0.00399001140310544,"pdam_00004385 Ankle1: Ankyrin repeat and LEM domain-containing protein 1 (Mus musculus)"
"pdam_00017489",184.993470090657,0.667859668532079,0.191102671966729,3.49476886774432,0.000474472448078063,0.00399001140310544,"pdam_00017489 tmem231: Transmembrane protein 231 (Xenopus tropicalis)"
"pdam_00019725",31.0769968709374,1.06231005735163,0.303990100297593,3.49455477764466,0.000474853155162862,0.00399001961445323,"pdam_00019725 eif1ad: Probable RNA-binding protein EIF1AD (Xenopus tropicalis)"
"pdam_00012700",864.882409565315,0.452898214266376,0.129597603561228,3.49464960632861,0.000474684490309912,0.00399001961445323,"pdam_00012700 At5g06550: F-box protein At5g06550 (Arabidopsis thaliana)"
"pdam_00008621",30.6566387000603,-1.05504027580847,0.301920745218709,-3.49442790042205,0.000475078909847232,0.00399032105932837,"pdam_00008621 capD: Capsule biosynthesis protein CapD (Bacillus anthracis)"
"pdam_00010302",102.541411281785,0.609868355700139,0.174536762062463,3.49421146865254,0.00047546424144817,0.00399036782509317,"pdam_00010302 unknown function"
"pdam_00011506",57.6861543405093,-1.1101043133585,0.317692236488467,-3.4942758615343,0.000475349566954153,0.00399036782509317,"pdam_00011506 Col28a1: Collagen alpha-1(XXVIII) chain (Mus musculus)"
"pdam_00016412",75.4760780226668,-1.07830219920568,0.308638535763034,-3.49373806008976,0.000476308106835946,0.00399585423758779,"pdam_00016412 unknown function"
"pdam_00024383",28.2107556437687,-1.34366945939005,0.384847658937927,-3.49143207236391,0.000480438614349974,0.00402889763789494,"pdam_00024383 unknown function"
"pdam_00001047",238.245837706651,-1.35914002673007,0.389351250867341,-3.49078120001509,0.000481610494717475,0.004037113899676,"pdam_00001047 SSC5D: Soluble scavenger receptor cysteine-rich domain-containing protein SSC5D (Homo sapiens)"
"pdam_00011495",107.739622916891,-1.30076956390586,0.372717735422851,-3.48995886238183,0.00048309490643193,0.00404794236788956,"pdam_00011495 Naalad2: N-acetylated-alpha-linked acidic dipeptidase 2 (Mus musculus)"
"pdam_00016516",38.9831876458039,-0.927641689744726,0.265929053052894,-3.48830516671758,0.000486092940226297,0.00407144007128562,"pdam_00016516 trim71: E3 ubiquitin-protein ligase TRIM71 (Xenopus tropicalis)"
"pdam_00003642",66.4915184174313,-0.995859133193085,0.285533964232332,-3.48770814663148,0.000487179551958859,0.00407729123234386,"pdam_00003642 P4htm: Transmembrane prolyl 4-hydroxylase (Mus musculus)"
"pdam_00010066",628.138664634826,1.16249796218931,0.333311191264559,3.48772556294577,0.00048714782118905,0.00407729123234386,"pdam_00010066 unknown function"
"pdam_00013772",247.673896713244,1.47194386334343,0.422070652143376,3.48743475972222,0.00048767788802572,0.00407983710862281,"pdam_00013772 jag1b: Protein jagged-1b (Danio rerio)"
"pdam_00023179",3.02515197129999,3.66284397581168,1.05039835021426,3.48709989411593,0.00048828893665757,0.00408178463202335,"pdam_00023179 unknown function"
"pdam_00017343",6.74224931608991,-2.08916420827415,0.599113194885333,-3.48709430222782,0.00048829914655754,0.00408178463202335,"pdam_00017343 GCR2: Putative tyramine receptor 2 (Locusta migratoria)"
"pdam_00020260",9.82863344100317,-1.66285133867918,0.476973288450664,-3.48625673374826,0.000489830663816596,0.00409295880719911,"pdam_00020260 unknown function"
"pdam_00009039",2.91366104117299,-4.31594444397462,1.23803520094016,-3.4861241753846,0.000490073460650852,0.00409336000619143,"pdam_00009039 unknown function"
"pdam_00000807",664.409883763931,1.50971568353682,0.433093126994026,3.48589157721185,0.000490499763871646,0.00409529302255171,"pdam_00000807 FST: Follistatin (Equus caballus)"
"pdam_00008213",217.515874664271,-1.28147748429219,0.367648455393338,-3.48560551661006,0.000491024526582422,0.00409704603860329,"pdam_00008213 Gulo: L-gulonolactone oxidase (Mus musculus)"
"pdam_00016396",119.994948734392,-1.59984444381559,0.458991477903853,-3.48556459288057,0.000491099641743597,0.00409704603860329,"pdam_00016396 unknown function"
"pdam_00008267",585.535956016452,-0.443209905101829,0.127178548194228,-3.48494232238722,0.000492243135037812,0.00410495614397604,"pdam_00008267 rasef: Ras and EF-hand domain-containing protein (Xenopus tropicalis)"
"pdam_00002047",340.619850485369,-0.70164766288018,0.201355921287814,-3.48461400286938,0.000492847459854278,0.00410836547752386,"pdam_00002047 yugO: Putative potassium channel protein YugO (Bacillus subtilis (strain 168))"
"pdam_00014612",261.359876405205,0.701758412965571,0.201409236926096,3.48424145623008,0.000493534029675209,0.00411245742808268,"pdam_00014612 MRPL21: 39S ribosomal protein L21%2C mitochondrial (Bos taurus)"
"pdam_00002353",122.406901226361,-2.61921172140379,0.751795084404915,-3.48394366461844,0.000494083473992224,0.00411540396589242,"pdam_00002353 Uncharacterized skeletal organic matrix protein 5 (Acropora millepora)"
"pdam_00014776",36.0933131991043,-0.95577806571309,0.274369247295699,-3.4835466260656,0.000494816922406591,0.00411988019983142,"pdam_00014776 unknown function"
"pdam_00024578",83.9464020044733,-1.52851620093278,0.438851056011394,-3.48299538076786,0.000495836919974856,0.00412673777159271,"pdam_00024578 unknown function"
"pdam_00018886",81.4286812407282,0.562376777982236,0.16148356629286,3.48256352576667,0.000496637372752226,0.00413176341583057,"pdam_00018886 Dnajc4: DnaJ homolog subfamily C member 4 (Mus musculus)"
"pdam_00019562",19.3248963966629,1.31908485850545,0.378944270589182,3.48094683277447,0.000499644659541747,0.00415513752286102,"pdam_00019562 GRM2: Metabotropic glutamate receptor 2 (Homo sapiens)"
"pdam_00009586",115.797183087906,-1.90780914043958,0.548105869734825,-3.48073108825231,0.000500047257705931,0.0041556129695467,"pdam_00009586 nphp3: Nephrocystin-3 (Xenopus laevis)"
"pdam_00009882",167.625310212803,-0.67337119020803,0.193458316953959,-3.48070427165085,0.000500097320960439,0.0041556129695467,"pdam_00009882 CHRNA3: Neuronal acetylcholine receptor subunit alpha-3 (Gallus gallus)"
"pdam_00005852",418.056725027441,0.596662998146916,0.171461059860735,3.47987466443717,0.000501648404784011,0.00416685423973755,"pdam_00005852 slc25a25: Calcium-binding mitochondrial carrier protein SCaMC-2 (Xenopus tropicalis)"
"pdam_00017211",69.6868608394363,1.1008514931507,0.316431456066636,3.47895720240555,0.0005033689695937,0.00417949383485247,"pdam_00017211 M6pr: Cation-dependent mannose-6-phosphate receptor (Mus musculus)"
"pdam_00005821",184.471382625857,1.19338613639187,0.343050221927868,3.47875051555219,0.000503757338905776,0.00418106653914095,"pdam_00005821 SULT1B1: Sulfotransferase family cytosolic 1B member 1 (Homo sapiens)"
"pdam_00003213",214.633017721102,0.928313760705038,0.266875536600215,3.47845206245214,0.000504318632048639,0.00418407266186425,"pdam_00003213 Tll2: Tolloid-like protein 2 (Mus musculus)"
"pdam_00016730",19.513517854644,-3.18797972965733,0.916575463073481,-3.4781421258729,0.000504902138977662,0.00418726063560204,"pdam_00016730 Pkd1l2: Polycystic kidney disease protein 1-like 2 (Mus musculus)"
"pdam_00013730",256.582374804373,-1.22343371147347,0.351804962479748,-3.47759083001535,0.000505941600466921,0.00419257205591969,"pdam_00013730 unknown function"
"pdam_00019870",6.06033573078811,-2.41449365504586,0.694286974897836,-3.47765944392252,0.000505812121186119,0.00419257205591969,"pdam_00019870 FucTA: Glycoprotein 3-alpha-L-fucosyltransferase A (Drosophila melanogaster)"
"pdam_00021605",15.6036666544433,-1.74987408869355,0.503204252509887,-3.4774628393252,0.000506183210506329,0.00419292083909756,"pdam_00021605 unknown function"
"pdam_00005154",112.898535313065,1.49901213425609,0.431153351523433,3.47674934906455,0.000507532049576103,0.00420243736085178,"pdam_00005154 unknown function"
"pdam_00024130",1718.57387951065,0.411839323208668,0.118488005953504,3.47578913067604,0.000509352612779765,0.00421585079069191,"pdam_00024130 ITGB1: Integrin beta-1 (Ovis aries)"
"pdam_00004906",74.4618448749995,-1.00615457349559,0.289523065769624,-3.47521386878447,0.000510446216997881,0.00422323907488601,"pdam_00004906 MNX1: Motor neuron and pancreas homeobox protein 1 (Homo sapiens)"
"pdam_00009522",533.767162834875,-0.903061787802888,0.259880743975108,-3.47490842911157,0.000511027763689573,0.00422472401807096,"pdam_00009522 LCC4: Laccase-4 (Trametes versicolor)"
"pdam_00018442",8.43874846872056,-2.00155339473133,0.575988413074394,-3.47498899161503,0.00051087431549995,0.00422472401807096,"pdam_00018442 bivm: Basic immunoglobulin-like variable motif-containing protein (Xenopus laevis)"
"pdam_00025358",1.60645939730272,-4.02015940307091,1.15725666633816,-3.47387016208917,0.000513009209793429,0.00423610551819604,"pdam_00025358 unknown function"
"pdam_00003977",1035.72175105938,0.686084089554195,0.197497307247874,3.47389085509458,0.000512969649070815,0.00423610551819604,"pdam_00003977 CCT8: T-complex protein 1 subunit theta (Gallus gallus)"
"pdam_00013750",351.992142801176,-0.676536465324153,0.194739189223641,-3.47406430118803,0.000512638168007407,0.00423610551819604,"pdam_00013750 Scai: Protein SCAI (Mus musculus)"
"pdam_00012672",651.326564477273,0.486542921488017,0.140076936664056,3.47339778463947,0.000513913071063537,0.00424190227352719,"pdam_00012672 Arl5b: ADP-ribosylation factor-like protein 5B (Mus musculus)"
"pdam_00020839",277.348949371332,-1.41292259026323,0.40693716376408,-3.47209032764176,0.000516422544893942,0.00426094219903659,"pdam_00020839 CCDC82: Coiled-coil domain-containing protein 82 (Homo sapiens)"
"pdam_00014756",1190.00960773617,-0.552038057465909,0.159014168307212,-3.47162811554869,0.000517312423147042,0.00426660932984109,"pdam_00014756 PURA: Transcriptional activator protein Pur-alpha (Homo sapiens)"
"pdam_00022868",15.4566855747028,-1.7888917586947,0.515403429353544,-3.47085730674796,0.000518799609967178,0.00427551913861186,"pdam_00022868 unknown function"
"pdam_00010321",746.027919928231,0.507116285485043,0.146106284973012,3.47087249243738,0.000518770272488055,0.00427551913861186,"pdam_00010321 SF3B3: Splicing factor 3B subunit 3 (Homo sapiens)"
"pdam_00012366",529.961476723156,-0.593134478436472,0.170914139251309,-3.4703651847337,0.000519751185922492,0.0042816821529444,"pdam_00012366 Whrn: Whirlin (Mus musculus)"
"pdam_00024821",13.5127324772931,-2.57659438320527,0.742485936245669,-3.47022651531105,0.000520019613229014,0.00428221480094347,"pdam_00024821 unknown function"
"pdam_00020218",997.230830877785,0.812955958915582,0.23430934963415,3.46958395038409,0.000521265136251547,0.0042899298874155,"pdam_00020218 arl6: ADP-ribosylation factor-like protein 6 (Danio rerio)"
"pdam_00013963",74.1650779496806,-0.749357385653109,0.215982229068931,-3.46953260406415,0.000521364783842931,0.0042899298874155,"pdam_00013963 Nt5dc2: 5'-nucleotidase domain-containing protein 2 (Rattus norvegicus)"
"pdam_00002996",39.2660201913563,0.914572629240404,0.263632416062598,3.46912053873999,0.000522165120503986,0.00429483366238406,"pdam_00002996 unknown function"
"pdam_00019657",250.674088902954,0.896575631256258,0.258456002576612,3.46896811185685,0.000522461462653671,0.00429545995466423,"pdam_00019657 trim71: E3 ubiquitin-protein ligase TRIM71 (Xenopus tropicalis)"
"pdam_00003057",694.305483423642,0.555393419286942,0.160107826485803,3.46887114438588,0.000522650064433806,0.00429545995466423,"pdam_00003057 unknown function"
"pdam_00020511",7.01971772893018,-1.98972787621471,0.573780588569035,-3.46775041863465,0.000524834486149683,0.0043117266326957,"pdam_00020511 ANGPTL7: Angiopoietin-related protein 7 (Homo sapiens)"
"pdam_00003698",228.417920319515,0.77292966031089,0.22292337053958,3.46724373689503,0.000525824856660125,0.00431817481934839,"pdam_00003698 HSCB: Iron-sulfur cluster co-chaperone protein HscB%2C mitochondrial (Homo sapiens)"
"pdam_00008095",34.7890478711038,1.24253020229606,0.358374860385507,3.46712434281651,0.000526058480185986,0.00431825245796709,"pdam_00008095 LACE1: Lactation elevated protein 1 (Homo sapiens)"
"pdam_00011637",13.2941156215192,1.55572212252983,0.448719108233414,3.46702891404522,0.000526245279317331,0.00431825245796709,"pdam_00011637 Sema5a: Semaphorin-5A (Mus musculus)"
"pdam_00021277",3.57839198498005,2.78718749337602,0.804011484544591,3.46660159332767,0.000527082505977784,0.00432325080632564,"pdam_00021277 unknown function"
"pdam_00005552",504.730627314964,-0.519851000474114,0.149963878797513,-3.46650809943398,0.000527265848994177,0.00432325080632564,"pdam_00005552 unknown function"
"pdam_00010058",2789.98396893666,0.514605622708458,0.148456632874834,3.46637002835925,0.000527536717268492,0.00432378475561519,"pdam_00010058 PRKAR1A: cAMP-dependent protein kinase type I-alpha regulatory subunit (Bos taurus)"
"pdam_00017029",124.450644346601,1.35513414285111,0.390964741746395,3.46612877876884,0.000528010312744714,0.00432535084830013,"pdam_00017029 CG4766: Protein mab-21-like (Drosophila melanogaster)"
"pdam_00025868",9.83380351094166,1.612011950798,0.465084429593487,3.46606303764458,0.000528139437389395,0.00432535084830013,"pdam_00025868 unknown function"
"pdam_00003335",11.6705137233307,-1.60275162512566,0.462447440661005,-3.46580277930558,0.000528650909594345,0.0043273568504146,"pdam_00003335 unknown function"
"pdam_00009431",27.7359752299246,1.27052850048843,0.366597775584819,3.46572888627489,0.000528796211842241,0.0043273568504146,"pdam_00009431 fgf1: Fibroblast growth factor 1 (Xenopus laevis)"
"pdam_00017031",1039.26630470141,1.12040540009636,0.323371282117541,3.46476469017155,0.000530695608187622,0.00434101026797301,"pdam_00017031 Pdk3: [Pyruvate dehydrogenase (acetyl-transferring)] kinase isozyme 3%2C mitochondrial (Mus musculus)"
"pdam_00018626",263.72747546146,-0.60544684760002,0.174748657314208,-3.4646723866461,0.000530877772481115,0.00434101026797301,"pdam_00018626 MIPOL1: Mirror-image polydactyly gene 1 protein (Homo sapiens)"
"pdam_00016917",96.5761207523147,1.35122331683976,0.390012339213698,3.46456555596152,0.000531088679383988,0.00434104573988896,"pdam_00016917 Tbc1d10b: TBC1 domain family member 10B (Mus musculus)"
"pdam_00002352",331.010807181686,0.678970815358477,0.196010686034984,3.46394795657872,0.000532309485492057,0.00434933275179455,"pdam_00002352 unknown function"
"pdam_00023021",316.098933546207,-3.00364709866508,0.867253560883653,-3.46340128670632,0.000533392266715942,0.00435648600273436,"pdam_00023021 unknown function"
"pdam_00007003",95.3153635252123,-0.661332477126555,0.190957694376092,-3.46324079418375,0.000533710541457406,0.0043573920080526,"pdam_00007003 Uhmk1: Serine/threonine-protein kinase Kist (Mus musculus)"
"pdam_00005657",133.988614408494,-0.934739880322942,0.269996460288162,-3.46204494431264,0.000536087623928007,0.00437509957935808,"pdam_00005657 unknown function"
"pdam_00013628",35.8786796233959,-0.874178148655462,0.252518994875538,-3.46183125386797,0.000536513430290101,0.00437687489811587,"pdam_00013628 Iqcc: IQ domain-containing protein C (Mus musculus)"
"pdam_00020217",230.299818930827,0.554041184418262,0.160102783528547,3.46053436553447,0.000539104418316524,0.00439630553004337,"pdam_00020217 LACE1: Lactation elevated protein 1 (Homo sapiens)"
"pdam_00016073",139.044744832641,0.664431304246991,0.192072447420379,3.45927442051479,0.000541632759761442,0.00441521041364884,"pdam_00016073 unknown function"
"pdam_00023379",35.2932977641593,1.45012468751292,0.419216662458321,3.45912941296099,0.000541924455369921,0.00441587531198096,"pdam_00023379 unknown function"
"pdam_00005562",73.1811505010215,-1.08012559306506,0.312296138324275,-3.45865817893498,0.000542873395513125,0.0044218931808947,"pdam_00005562 Gabrb1: Gamma-aminobutyric acid receptor subunit beta-1 (Rattus norvegicus)"
"pdam_00006269",26.6655633163984,-1.18825498002309,0.343616508461677,-3.4580846692807,0.000544030380086032,0.00442960032448971,"pdam_00006269 RERG: Ras-related and estrogen-regulated growth inhibitor (Homo sapiens)"
"pdam_00014182",52.3169195565396,-0.853867506011815,0.246953352760203,-3.45760645266856,0.000544996878697786,0.00443575112541982,"pdam_00014182 Prr11: Proline-rich protein 11 (Mus musculus)"
"pdam_00012169",374.29464728586,-1.64094390958727,0.474660982222738,-3.45708615421278,0.000546050243527687,0.00444260389769041,"pdam_00012169 ACSM1: Acyl-coenzyme A synthetase ACSM1%2C mitochondrial (Bos taurus)"
"pdam_00001721",10.3108685954007,-1.7424331508833,0.504040191390414,-3.45693296020052,0.000546360752118868,0.00444340990935681,"pdam_00001721 unknown function"
"pdam_00019405",84.1100644595579,-1.25060689059726,0.361863930144691,-3.45601422638948,0.000548226385502877,0.00445685783030675,"pdam_00019405 Hlx: H2.0-like homeobox protein (Mus musculus)"
"pdam_00020003",216.6031890976,-1.38987238310449,0.402185610173175,-3.45579838748091,0.00054866554035192,0.00445870314404315,"pdam_00020003 unknown function"
"pdam_00000048",260.253216185697,-0.972391541104117,0.281409139123997,-3.4554369631743,0.000549401643208372,0.00446295923155158,"pdam_00000048 unknown function"
"pdam_00025544",20.8780794312919,-1.29346608724055,0.374352376892155,-3.45521002959512,0.000549864302582079,0.0044649916223966,"pdam_00025544 unknown function"
"pdam_00023840",730.124058161769,-2.43467345647002,0.70478429437454,-3.45449448278451,0.000551325496487657,0.00447512758157131,"pdam_00023840 unknown function"
"pdam_00002133",580.19031299215,-0.994668920657715,0.287974426088828,-3.45401824101874,0.000552300017576465,0.00447860294626368,"pdam_00002133 MYL9: Myosin regulatory light polypeptide 9 (Pongo abelii)"
"pdam_00025473",11.97781305343,-2.49126583255116,0.721275454525053,-3.45397284341474,0.000552392997226527,0.00447860294626368,"pdam_00025473 At3g55350: Protein ALP1-like (Arabidopsis thaliana)"
"pdam_00019774",409.092802790688,-0.477943773041871,0.138366850081624,-3.45417831481983,0.00055197228385728,0.00447860294626368,"pdam_00019774 unknown function"
"pdam_00009346",1146.63000523613,0.367805651967114,0.10649226574994,3.45382502078391,0.000552695856463901,0.00447933028291125,"pdam_00009346 BPTF: Nucleosome-remodeling factor subunit BPTF (Homo sapiens)"
"pdam_00017201",81.3893455480147,-1.01250457624731,0.293218146942827,-3.45307610324929,0.000554232618128752,0.00449005338086959,"pdam_00017201 gtpA: GTP-binding protein A (Dictyostelium discoideum)"
"pdam_00001517",221.016587677346,-0.622713590182698,0.180352563005564,-3.45275708759119,0.000554888438975211,0.00449225473599472,"pdam_00001517 KIF25: Kinesin-like protein KIF25 (Homo sapiens)"
"pdam_00021887",10.5848601065913,2.85336920988431,0.826408168088555,3.45273597244812,0.000554931872217097,0.00449225473599472,"pdam_00021887 SLC18B1: MFS-type transporter SLC18B1 (Homo sapiens)"
"pdam_00015166",357.857980785914,1.02139836430633,0.295894209373074,3.45190386277047,0.000556646021327282,0.00450266210092103,"pdam_00015166 nrf-6: Nose resistant to fluoxetine protein 6 (Caenorhabditis elegans)"
"pdam_00011984",21.9146627216763,1.14447679436314,0.331544501773993,3.45195528274303,0.000556539953188306,0.00450266210092103,"pdam_00011984 unknown function"
"pdam_00004498",131.278195546477,0.661328785674714,0.191625012329114,3.45116108610544,0.000558180308823279,0.00451333558673383,"pdam_00004498 NAT10: RNA cytidine acetyltransferase (Homo sapiens)"
"pdam_00010143",1139.07784983677,0.980477764262711,0.284135078208882,3.45074522457207,0.000559041035940476,0.00451855668088042,"pdam_00010143 MPHOSPH8: M-phase phosphoprotein 8 (Homo sapiens)"
"pdam_00015311",371.012856269184,0.540486134418382,0.156696334157476,3.44925832071609,0.000562128669082899,0.00454176623636183,"pdam_00015311 Smarce1: SWI/SNF-related matrix-associated actin-dependent regulator of chromatin subfamily E member 1 (Mus musculus)"
"pdam_00017865",1202.75129230726,0.463985688143971,0.134577258575501,3.44772729846971,0.000565324506987568,0.00456583186562019,"pdam_00017865 chmp4b: Charged multivesicular body protein 4b (Xenopus tropicalis)"
"pdam_00008238",5928.63593766795,0.604466175443036,0.175406868035006,3.44608043125428,0.000568781042723271,0.00459198371603133,"pdam_00008238 ABT: ADP%2CATP carrier protein (Chlamydomonas reinhardtii)"
